{"aggregate_source_sha256":"2339eb3b1fdaa5bfc223bced919a8246606dc3a06ab738383e206c9ca5c878b0","artifact_identity_sha256":"1dc1809c6d1144df71735666d8f0bb608207b0ecc69307fd79af934677ae1be3","format_version":"invarlock/runtime-scoring-observation-v1","provider_name":"llama_cpp","records":[{"error_code":null,"input_sha256":"f757482158b95886e6bdc946c83e70bfe17d2c57e7dbb3a6286d0eed28a4ba69","logprob_sum":null,"output_sha256":"e3b0c44298fc1c149afbf4c8996fb92427ae41e4649b934ca495991b7852b855","output_text":"","record_id":"qwen-quantization","status":"ok","token_count":null,"utf8_byte_count":null}],"schedule_sha256":"cfe1f792e3463771475b2ba8c10e2fe9c22a3b18f23372a89c56f0bcdb6c34c7"}