{"aggregate_source_sha256":"dad94fa205a8372c20505fbd4ca14e74eb71e530bfca66a5150a3b8b9f528972","artifact_identity_sha256":"2167735562615a64ac099679fda25ab76e421e8466891ec775b70a9d873b146d","format_version":"invarlock/runtime-scoring-observation-v1","provider_name":"hf_transformers","records":[{"error_code":null,"input_sha256":"060346f09b6003099ca6a718c19a3492513b1517a665dcef4a07a7dc2cea49c5","logprob_sum":-12.0078125,"output_sha256":null,"output_text":null,"record_id":"capital","status":"ok","token_count":2,"utf8_byte_count":6},{"error_code":null,"input_sha256":"61352d57aafb9970a5170d05074b8182ed22762fca62c25ec3dea7e6598bab58","logprob_sum":-17.8701171875,"output_sha256":null,"output_text":null,"record_id":"freezing","status":"ok","token_count":4,"utf8_byte_count":21},{"error_code":null,"input_sha256":"dea74e3ac038727b4a134e6b295eedf5bf3eaa24bba51210bbefdd55e9fcee6f","logprob_sum":-12.65625,"output_sha256":null,"output_text":null,"record_id":"opposite","status":"ok","token_count":2,"utf8_byte_count":5},{"error_code":null,"input_sha256":"b432fe1b5d07052e9d835be2b4bf9a0405377cef8c01e8e060928bbc1dc0b953","logprob_sum":-22.46484375,"output_sha256":null,"output_text":null,"record_id":"story","status":"ok","token_count":6,"utf8_byte_count":26},{"error_code":null,"input_sha256":"2749335eccef560282e9c5b0310246dd33acf669da7a5ed289ab6cb939abc340","logprob_sum":-15.171875,"output_sha256":null,"output_text":null,"record_id":"arithmetic","status":"ok","token_count":2,"utf8_byte_count":5},{"error_code":null,"input_sha256":"80010345dbdaaf0e9d72d87bda0a33dad88c1c17373e13d1097d805869644ec7","logprob_sum":-25.259521484375,"output_sha256":null,"output_text":null,"record_id":"planet","status":"ok","token_count":3,"utf8_byte_count":8},{"error_code":null,"input_sha256":"ffa610841f681a5a4625a5659990230e3b61aa6246b8f12732615b9db16a2400","logprob_sum":-21.12890625,"output_sha256":null,"output_text":null,"record_id":"triangle","status":"ok","token_count":3,"utf8_byte_count":12},{"error_code":null,"input_sha256":"a1332a5bf23551368e386a1a2681be0a4f52b5f11be85ffcfba38864f897d091","logprob_sum":-26.3701171875,"output_sha256":null,"output_text":null,"record_id":"water-symbol","status":"ok","token_count":4,"utf8_byte_count":4},{"error_code":null,"input_sha256":"ca075fe2d16a498ede410187264d1ce16601a8173cbdeeb952c56aeee2ad04f4","logprob_sum":-15.974365234375,"output_sha256":null,"output_text":null,"record_id":"brazil-language","status":"ok","token_count":4,"utf8_byte_count":11},{"error_code":null,"input_sha256":"6ba5878f7e2da976638b85053d1f5bce48d30d16c81ae951094d31375e995cd4","logprob_sum":-13.6240234375,"output_sha256":null,"output_text":null,"record_id":"hamlet-author","status":"ok","token_count":3,"utf8_byte_count":20},{"error_code":null,"input_sha256":"ed178c785853db5883f3bc6684950873a54fa4b5bedee3c4b63fc30b1974883b","logprob_sum":-2.1449947357177734,"output_sha256":null,"output_text":null,"record_id":"light-speed","status":"ok","token_count":11,"utf8_byte_count":30},{"error_code":null,"input_sha256":"8c1afacbd057af41502b801ce6be5b5d798cefc7bbf0082532c5b4657f0875aa","logprob_sum":-10.999847412109375,"output_sha256":null,"output_text":null,"record_id":"photosynthesis","status":"ok","token_count":3,"utf8_byte_count":15},{"error_code":null,"input_sha256":"1057f7fd4111323425956fb2d715b39a36a06e0b1b5d7951cb6ba0e2a4b16faa","logprob_sum":-2.0532684326171875,"output_sha256":null,"output_text":null,"record_id":"boiling-point","status":"ok","token_count":6,"utf8_byte_count":20},{"error_code":null,"input_sha256":"da5af48ad54c282ed868cfb74f402cdb8e34229ca995e28bdf5549f20488faaf","logprob_sum":-16.3515625,"output_sha256":null,"output_text":null,"record_id":"square-root","status":"ok","token_count":2,"utf8_byte_count":6},{"error_code":null,"input_sha256":"e7832431bdb6266c34cefc5b5b1f4c690370bce2e3142057b3df0ea958b91ad9","logprob_sum":-15.34375,"output_sha256":null,"output_text":null,"record_id":"first-month","status":"ok","token_count":2,"utf8_byte_count":8},{"error_code":null,"input_sha256":"bc7d67c325a664d289557cf61fd48dac1080c8f9ce3add1f394609819d56a5d8","logprob_sum":-16.98828125,"output_sha256":null,"output_text":null,"record_id":"mixed-color","status":"ok","token_count":2,"utf8_byte_count":6}],"schedule_sha256":"b436f42968fe665bd6f86c823d635d94c5e870930ef45207a7d28de3a665aa59"}